{
    "room_id": "G-08",
    "name": "Open Lab",
    "floor_no": "G",
    "capacity": "30-40 students",
    "area": "100 sq. ft.",
    "person_in_charge": "Mr.ABC",
    "link": "",
    "features": [
        "whiteboards",
        "facilities for using laptops"
    ],
    "accessibility": {
        "academic_staff": true,
        "instructors": true,
        "technical_officers": true,
        "undergrad_students": true,
        "postgrad_students": true,
        "guests": true
    },
    "staff_ids": [
        "ABCr",
        "XYZj"
    ],
    "additional_notes": "To be used by students for group-work, tech talks, etc.. After Hours access through G-11 .",
    "tags": [
        "lab"
    ]
}
