{
    "room_id": "G_08",
    "name": "Open Lab - I",
    "floor_no": "G",
    "capacity": "30-40",
    "area": "",
    "person_in_charge": "",
    "link": "https://ce.pdn.ac.lk/facilities/open-lab",
    "features": [
        "Whiteboards",
        "Facilities for using laptops"
    ],
    "accessibility": {
        "academic_staff": true,
        "instructors": true,
        "technical_officers": true,
        "undergrad_students": true,
        "postgrad_students": true,
        "guests": true
    },
    "staff_ids": [],
    "additional_notes": "To be used by students for group-work, tech talks etc. After hours access through G-11.",
    "tags": [
        "lab",
        "public"
    ]
}
