{
    "room_id": "g_07",
    "name": "Staff Common Room",
    "floor_no": "G",
    "capacity": "",
    "area": "",
    "person_in_charge": "",
    "link": "",
    "features": [],
    "accessibility": {
        "academic_staff": true,
        "instructors": true,
        "technical_officers": true,
        "undergrad_students": false,
        "postgrad_students": false,
        "guests": false
    },
    "staff_ids": [],
    "additional_notes": "To be used for lunch, tea and other informal gatherings.",
    "tags": [
        "staff"
    ]
}