{
    "room_id": "1_00",
    "name": "Computer Laboratory 2",
    "floor_no": "1",
    "capacity": "64",
    "area": "",
    "person_in_charge": "",
    "link": "",
    "features": [
        "2 built in projectors and screens 64 computers"
    ],
    "accessibility": {
        "academic_staff": true,
        "instructors": true,
        "technical_officers": true,
        "undergrad_students": true,
        "postgrad_students": true,
        "guests": false
    },
    "staff_ids": [],
    "additional_notes": "",
    "tags": [
        "lab"
    ]
}